type,name,description,examples
AM,Autres matières,"Plastique, verre, céramique, matières synthétiques, etc...\n(40 à 70% du poids)","Plastique, Verre, Céramique, Matières synthétiques"
MC,Métaux communs,"Aluminium, cuivre, nickel, etc...\n(L'extraction nécessite beaucoup de ressources et d'énergie)","Aluminium, Cuivre, Nickel"
MR,Métaux rares,"Lithium, tantale, indium, etc...\n(Non précieux mais peu fréquent dans le sol)","Lithium, Tantale, Indium"
TR,Terres rares,"Yttrium, néodyme, gadolinium, etc...\n(Pas si rare mais difficile à extraire)","Yttrium, Néodyme, Gadolinium"
MP,Métaux précieux,"Or, argent, platine, palladium, etc...\n(Précieux mais aussi rare, stratégique donc cher)","Or"
